,Title,Link,Date
0,FSB Statement to encourage final preparations for the USD LIBOR transition,https://www.fsb.org/2023/04/fsb-statement-to-encourage-final-preparations-for-the-usd-libor-transition/,27 April 2023
1,Climate-related Financial Risk Factors in Compensation Frameworks,https://www.fsb.org/2023/04/climate-related-financial-risk-factors-in-compensation-frameworks/,20 April 2023
2,Recommendations to Achieve Greater Convergence in Cyber Incident Reporting: Final Report,https://www.fsb.org/2023/04/recommendations-to-achieve-greater-convergence-in-cyber-incident-reporting-final-report/,13 April 2023
3,Format for Incident Reporting Exchange (FIRE): A possible way forward,https://www.fsb.org/2023/04/format-for-incident-reporting-exchange-fire-a-possible-way-forward/,13 April 2023
4,Cyber Lexicon: Updated in 2023,https://www.fsb.org/2023/04/cyber-lexicon-updated-in-2023/,13 April 2023
5,Achieving Greater Convergence in Cyber Incident Reporting: Overview of responses to consultative document,https://www.fsb.org/2023/04/achieving-greater-convergence-in-cyber-incident-reporting-overview-of-responses-to-consultative-document/,13 April 2023
6,FSB Chair’s letter to G20 Finance Ministers and Central Bank Governors: April 2023,https://www.fsb.org/2023/04/fsb-chairs-letter-to-g20-finance-ministers-and-central-bank-governors-april-2023/,12 April 2023
